text,categories,expected_category
"Restorative Justice Service- West Yorkshire Restorative Justice is defined as the process that brings those harmed by crime, and those responsible for the harm, into communication, enabling everyone affected by a particular incident to play a part in repairing the harm and finding a positive way forward.  The Mayor of West Yorkshire is committed to providing Restorative Justice to victims of crime and has approved the re-commission a West Yorkshire wide Restorative Justice service with a budget of £280,000 to £300,000 per annum for an initial 3-year contract, with two optional 2-year extensions, to a maximum of 7 years in total.  The requirements are for a West Yorkshire wide Restorative Justice service that will be available for all crime types as no victim should be denied restorative justice on the basis of the type of crime they have experienced.",justice_services,justice_services
"23NW SGL 336 Straightwall Herbicide The Pennsylvania Game Commission (PGC), Northwest Region, requires the combination of foliar spray AND cut stump treatments on all multiflora rose, autumn olive, Asiatic honeysuckle, Oriental bittersweet, Privet, Burning Bush, and Japanese barberry on 27 acres of State Game Lands 336 located in Lawrence County.",planting_and_maintenance_services_of_green_ar,planting_and_maintenance_services_of_green_ar
"Lean Six Sigma Training and Quality Improvement The State, as represented by the Wisconsin Department of Justice, is soliciting bids from qualified bidders to provide Lean Six Sigma Green Belt Training and Certification and Quality Improvement Project to the Wisconsin Department of Justice Division of Forensic Sciences Laboratory.",specialist_training_services,specialist_training_services
"IFB 2024-B06 Sentinel Peak - Asbestos Abatement & Building Demolition ﻿Hays County (County) is seeking bids from qualified, licensed, and experienced General Abatement Contractors to provide all labor, materials, and equipment necessary for the permitting, abatement, demolition, removal and environmentally appropriate disposal of all structures and debris located at Sentinel Peak.",,building_demolition_and_wrecking_work_and_ear
The purchase of a generator and automatic transfer switch THE TEXAS DEPARTMENT OF CRIMINAL JUSTICE (TDCJ) IS CURRENTLY        REQUESTING BIDS TO ESTABLISH A PURCHASE ORDER FOR THE PROCUREMENT OFA GENERATOR AND AUTOMATIC TRANSFER SWITCH.,generators,generators
"Community Audiology – Support Services The following line should be included: ‘This is a Provider Selection Regime (PSR) intention to award notice. The awarding of this contract is subject to the Health Care Services (Provider Selection Regime) Regulations 2023. For the avoidance of doubt, the provisions of the Public Contracts Regulations 2015 do not apply to this award. The publication of this notice marks the start of the standstill period. Representations by providers must be made to decision makers by 16 February 2024. This contract has not yet formally been awarded; this notice serves as an intention to award under the PSR.’<br/><br/>You should provide an address (which could be an email address) where written representations should be sent.<br/><br/>You must:<br/>- include details of the award decision-makers;<br/>- note any declared conflicts or potential conflicts of interest of individuals making the decision and how these were managed; and<br/>- include a statement explaining the relative importance of the key criteria that the relevant authority used to make a decision, the rationale for the relative importance of the key criteria, and the rationale for choosing the provider with reference to the key criteria.<br/><br/>Sample wording: 'Conflicts of interest identified among [group/committee/officer]: [number]. The non-conflicted members have assessed the nature and risk of this conflict, and have decided which steps to take to avoid or manage it. [Potential steps may include: excluding the conflicted member from related discussions, excluding the conflicted member from decision-making, delegating the matter to a sub-committee of non-conflicted decision-makers, or seeking independent advice to help make the decision. This list is illustrative rather than exhaustive.]'<br/><br/><br/>SCHEDULE 3<br/><br/>Regulation 9(4)<br/><br/>Content of notice of intention to award to the existing provider under Direct Award Process C<br/><br/>1.A statement that the relevant authority is intending to award a contract to an existing provider following Direct Award Process C.<br/>An award has been made following Direct Award Process C<br/><br/>2.The contract title and reference.<br/>Title - Community Audiology – Support Services<br/>Reference - Community Audiology Service 2024-25<br/><br/>3.The name and address of the registered office or principal place of business of the provider to whom an award is to be made.<br/><br/>RNID<br/>Brightfield Business Hub<br/>Orton Southgate<br/>Peterborough<br/>PE2 6XU            <br/><br/>4.A description of the relevant health care services to which the contract relates, including the most relevant CPV code<br/>Description - Voluntary Sector Support to Community Audiology Patients within North East Essex<br/>CPV Code – 85323000-9 Community health services, but only in respect of community health services which are delivered to individuals<br/><br/>5.The approximate lifetime value of the contract.<br/>£40,000<br/><br/>6.Details of the award decision-makers.<br/>Governance – NICS Collaborative and NEE Community Services (NEECS) DMT <br/><br/>Key Individuals - East Suffolk and North Essex NHS Foundation Trust (ESNEFT)::<br/><br/>Associate Director of Operations- NEECS<br/>General Manager Unplanned & Urgent Care – NEECS<br/>Clinical Lead for Community Audiology - Acute<br/><br/>7.A statement explaining the award decision-makers’ reasons for selecting the chosen provider, with reference to the key criteria.<br/>Key Criteria:<br/><br/>A.	Quality and Innovation – The provider brings quality, learning and innovations from the services they deliver nationally and, where suitable, incorporate them in the service they deliver in North",medical_practice_and_related_services,medical_practice_and_related_services
"University of St Andrews: Design & Manufacture of Safepoint Desks Design and Manufacture of Safepoint Desks including delivery and installation. It is anticipated that the requirement will be for c.40 no. desks. A SafePoint is an approved room containing a SafePoint Desk which allows a researcher to access and analyse data. It is a low cost and scalable solution for data access and will become a new service offered by the SafePod Network.  For more information about the SafePod Network visit www.safepodnetwork.ac.uk. A SafePoint Desk houses the SafePod Network IT system securely and includes a CCTV camera, EyeCube (switches off the monitor when no motion is detected at the desk) and dual monitors. It includes a screen barrier to prevent oversight risk of the desk and provides adjustments for researcher comfort and accessibility. A SafePoint Desk would typically be placed in the corner of a room.  The walls in the corner of the room will form a natural barrier on two sides to create a four-wall enclosure with an entrance and exit point on the opposite side to the room walls. Security policies will govern the SafePoint Desk and the room that it is located. Please see ITT (Invitation to Tender) for full details and specification.",,tables_cupboards_desk_and_bookcases
"Provision of Cleaning Services for Brodick Terminal CalMac Ferries Ltd are looking to award a single supplier the Contract for cleaning at our Brodick site. This service will ensure cleanliness is upheld on-site at Brodick to ensure a satisfactory service is provided to our customers with health and safety at forefront of CalMac’s priorities. Whilst cleaning services are paramount for customer satisfaction, it is also important to ensure that the facilities are upkept so that CalMac employees have clean working facilities.",cleaning_services,cleaning_services
"HCC - 02/24 - Pre-Procurement Market Engagement (PPME) for Interim arrangements for the inspection, maintenance, and repair of mechanical, electrical and other technology equipment at the A505 Weston Hertfordshire County Council (the ""Council"") is carrying out Pre-Procurement Market Engagement (""PPME"") for Interim arrangements for the inspection, maintenance, and repair of mechanical, electrical and other technology equipment at the A505 Weston Hills TunnelThe Council is seeking input from the market as to what might be the most attractive way of packaging and scoping any future opportunity for contracts.  This input will help inform any resultant procurement process. Please refer to the PPME document for more detailed information.The Council will consider the feedback received to help inform the Council’s options and further decision making. For the avoidance of doubt, this stage of the project is not part of a formal procurement process, and the Council is not committing, at this stage, to carrying out such a process. Participation or non-participation in the PPME shall not prevent any supplier participating in a potential future procurement, nor is it intended that any information supplied as part of the PPME shall place any supplier at an advantage in a potential procurement process. Participation in the PPME will be at each organisation’s own cost. No expense in responding to this PPME will be reimbursed by the Council.Further information can be found within the attached documentation. You are invited to submit a completed questionnaire by 12 noon on 11th March 2024. Please log in or register at https://in-tendhost.co.uk/supplyhertfordshire/aspx/Home",repair_and_maintenance_services_of_electrical,repair_and_maintenance_services_of_machinery
"Digital and Data Capabilities Framework Our current thinking is that this lot encompasses all competences and skills required to achieve NESO's objectives under its business plan, digitalisation strategy, and digital first ambitions, including without limitation the provision of all current services fulfilled by the National Grid Group, as well as supporting NESO as a full end to end business, and expanding these same services to cover the new roles within, and ambitions of, NESO.  The supplier for this lot will be responsible for providing end to end capabilities to enable partnership delivery of large or more specific projects.  Indicative examples of required capabilities are as follows:  Project Management Office  Business Analysis  Product Design and Management  Infrastructure Management and Support  Solution Delivery Management  Release Management  End-to-end user experience (UX) management  UVDB Codes to be registered on Achilles:  2.1.2.0	Software Development Services  2.1.3.0	Software Support Services  2.1.10.0	Data Collection & Handling Services  2.2.0		Business Consultancy  2.2.3.0	IT Consultancy  2.2.10.0	Security Consultancy  2.2.22.0	Risk Management Consultancy  2.6.41.0	Business Project Management","systems_and_technical_consultancy_services, business_and_management_consultancy_services",systems_and_technical_consultancy_services
"Student Dashboard System Texas A&M University, subsequently referred to as TAMU, School of Medicine is seeking proposals and intends to enter into an agreement with a qualified vendor to provide a Student Dashboard System.",,educational_software_package
"Waste & Recycling Collection Services The London Borough of Merton is inviting tenders, from those suppliers shortlisted in the initial Supplier Selection stage, to provide Household Waste & Recycling Materials collection including communication of the services, Commercial Waste collection including communication of the services, Winter Maintenance services and Vehicle Maintenance services for the Borough. Please note, that a signed confidentiality letter will need to be signed in order for the full suite of tender documents to be shared.",refuse_disposal_and_treatment,refuse_disposal_and_treatment
"Connally Unit: Replace Plumbing & Controls - 3, 4, 7, 10, & 11 Bldgs This project is to replace plumbing and add electronic water controls to multiple buildings. The existing system is not in compliance with the current energy efficiency codes and standards.",,plumbing_and_sanitary_works
"Action Plan for Food Production Units in Carmarthenshire Development of an action plan for food production units in Carmarthenshire The aim of the contract is to seek a qualified professional to undertake a Development Action Plan for the creation of Innovative Food Production Units for the County. The successful contractor will be required to scope the demand for food units and provide justification for the specific requirements. Looking at current and on-trend growth businesses, locally and regionally, that are seeking to expand from Micro-SME, with multi-sector commercial markets. The Plan will enable the Authority to move forward with physical design and build plans.",development_consultancy_services,development_consultancy_services
"NRTS3 National Roadside Telecommunications Service This opportunity relates to the provision, operation and maintenance of telecommunications services between the roadside and various central locations for National Highways , the body responsible for England's strategic road network.  The National Roads Telecommunications Services (NRTS) project currently provides services to over 30,000 end devices on 3 500 + km of the strategic road network. These telecommunications services provide connectivity between control rooms and roadside devices such as variable message signs, emergency telephones and CCTV cameras.",telecommunications_cable_and_equipment,telecommunications_cable_and_equipment
"ITT For the Provision of Agency Staff Services. We are now going out to tender for a range of employment agency organisations, to form a Preferred Suppliers List (PSL) within RBH. This ‘Preferred Suppliers List’ will be made up of a number of varied specialised agencies, that can be utilised by RBH at any time, based on pre-determined contracts,  during the life of the agreement.The tender will be made up of two ‘Lots’, and interested parties can bid for a place in either, or both of the ‘Lots’, dependant upon the suitability of your organisation.Lot 1 – Agency Staff.  The supply of short term agency staff, to support teams across RBH when temporary additional resource is required.Lot 2 – Single Role Recruitment.  To be able to provide candidates for RBH to consider for permanent RBH employee roles.Please Note: RBH cannot commit to any particular level of spend during the course of this contract. Usage will depend entirely on demand, i.e. the fluctuating requirements of teams across RBH as and when they arise.",supply_services_of_personnel_including_tempor,supply_services_of_personnel_including_tempor
"UK-Newcastle-upon-Tyne: Educational software package. UK-Newcastle-upon-Tyne: Educational software package.Section I: Contracting Authority		I.1) Name and addresses				 NCG				 Rye Hill House, Scotswood Road, Newcastle-upon-Tyne, NE4 7SA, United Kingdom				 Tel. +44 1912004000, Email: procurement@ncgrp.co.uk				 Contact: NCG Procurement				 Main Address: www.ncgrp.co.uk				 NUTS Code: UK		I.2) Joint procurement		The contract involves joint procurement:  No.		In the case of joint procurement involving different countries, state applicable national procurement law:  Not provided 				The contract is awarded by a central purchasing body:  No.		I.3) Communication		The procurement documents are available for unrestricted and full direct access, free of charge, at:    https://neupc.delta-esourcing.com/delta/mainMenu.html 		Additional information can be obtained from:  the abovementioned address 		Tenders or requests to participate must be sent  electronically via https://neupc.delta-esourcing.com/delta/mainMenu.html  to the abovementioned address 				Electronic communication requires the use of tools and devices that are not generally available. Unrestricted and full direct access to these tools and devices is possible, free of charge, at:  Not provided 		I.4) Type of the contracting authority				Body governed by public law 		I.5) Main activity				EducationSection II: ObjectII.1) Scope of the procurement		II.1.1) Title:  Teaching & Learning Platform for West Lancashire College 				Reference Number:   NCG240102T 		II.1.2) Main CPV Code: 		48190000 - Educational software package. 		II.1.3) Type of contract:  SUPPLIES 		II.1.4) Short description:  NCG is seeking to procure organisations with a pre-established online and distance learning platform for use by West Lancashire College for the entire duration of the contract term to enable the delivery of an online and distance learning offer to learners in non-devolved Authority Areas throughout England. 				II.1.5) Estimated total value:		Value excluding VAT:  1,200,000 				Currency:  GBP 		II.1.6) Information about lots:		This contract is divided into lots: No 		 II.2) Description 		II.2.2) Additional CPV codes: 		Not Provided 				II.2.3) Place of performance: 		UK UNITED KINGDOM  		II.2.4) Description of procurement:  NCG is seeking to procure organisations with a pre-established online and distance learning platform for use by West Lancashire College for the entire duration of the contract term to enable the delivery of an online and distance learning offer to learners in non-devolved Authority Areas throughout England. 		II.2.5) Award criteria:				Criteria below				Quality criterion - Name: Platform / Weighting: 10 				Quality criterion - Name: Awarding Organisations / Weighting: 5 				Quality criterion - Name: Reporting / Weighting: 5 				Quality criterion - Name: Support / Weighting: 5 				Quality criterion - Name: Charging / Weighting: 5 				Quality criterion - Name: Quality Assurance / Weighting: 5 				Quality criterion - Name: Data Protection / Weighting: 5  				Price  -  Weighting: 60   		II.2.6) Estimated value: 		Value excluding VAT:  1,200,000  				Currency:  GBP  				II.2.7) Duration of the contract, framework agreement or dynamic purchasing system:		Duration in months: 48 				This contract is subject to renewal:   Yes  				Description of renewals:  36 month initial period with the option of a 12 month extension.  		II.2.10) Information about variants: 		Variants will be accepted: No 		II.2.11) Information about options:		Options:		 No 						Description of options:  Not provided 		II.2.12) Information about electronic catalogues: 		Tenders must be presented in the form of electronic catalogues or include an electronic catalogue:  No 		II.2.13) Information about European Union funds: 		The procurement is related to a project and/or programme financed by European Union funds:   No 				Identification of the project: Not provided 						II.2.14) Additional information:  Not provided 		Section III: Legal, Economic, Financial And Technical Information	III.1) Conditions for participation		III.1.1) Suitability to pursue the professional activity, including requirements relating to enrolment on professional or trade registers		List and brief description of conditions: 					Not Provided 				III.1.2) Economic and financial standing 				List and brief description of selection criteria: 				Not Provided 			Minimum level(s) of standards possibly required (if applicable) : 				Not Provided 			III.1.3) Technical and professional ability 		List and brief description of selection criteria: 				Not Provided				Minimum level(s) of standards possibly required (if applicable) : 					Not Provided			III.1.5) Information about reserved contracts (if applicable)			The contract is reserved to sheltered workshops and economic operators aiming at the social and professional integration of disabled or disadvantaged persons:  No 				The execution of the contract is restricted to the framework of sheltered employment programmes:          No 	 	III.2) Conditions related to the contract 		III.2.2) Contract performance conditions 					Not Provided 					III.2.3) Information about staff responsible for the performance of the contract		Obligation to indicate the names and professional qualifications of the staff assigned to performing the contract:  No Section IV: Procedure	IV.1) Description OPEN		IV.1.1) Type of procedure: Open	 	IV.1.3) Information about a framework agreement or a dynamic purchasing system  	                			The procurement involves the establishment of a framework agreement - NO 	   			In the case of framework agreements justification for any duration exceeding 4 years:   Not Provided 	  	IV.1.6) Information about electronic auction:		An electronic auction will be used: No 		Additional information about electronic auction:  Not provided 	IV.1.8) Information about the Government Procurement Agreement (GPA)		The procurement is covered by the Government Procurement Agreement:  No 			IV.2) Administrative information		IV.2.1) Previous publication concerning this procedure:			Notice number in the OJ S:  Not provided 				IV.2.2) Time limit for receipt of tenders or requests to participate		 Date: 11/03/2024    Time: 17:00 		IV.2.4) Languages in which tenders or requests to participate may be submitted: English, 				IV.2.6) Minimum time frame during which the tenderer must maintain the tender:  Not Provided				IV.2.7) Conditions for opening of tenders: 			Date: 11/03/2024			Time: 17:00 Section VI: Complementary Information	VI.1) Information about recurrence	This is a recurrent procurement: No  		Estimated timing for further notices to be published:  Not provided 	VI.2) Information about electronic workflows	Electronic ordering will be used  No 			Electronic invoicing will be accepted  No 			Electronic payment will be used  No 			VI.3) Additional Information:  The contracting authority considers that this contract may be suitable for economic operators that are small or medium enterprises (SMEs). However, any selection of tenderers will be based solely on the criteria set out for the procurement.For more information about this opportunity, please visit the Delta eSourcing portal at: https://neupc.delta-esourcing.com/tenders/UK-UK-Newcastle-upon-Tyne:-Educational-software-package./X6XKHA2687To respond to this opportunity, please click here: https://neupc.delta-esourcing.com/respond/X6XKHA2687 	VI.4) Procedures for review	VI.4.1) Review body:				 NCG		 Rye Hill House, Scotswood Road, Newcastle-upon-Tyne, NE4 7SA, United Kingdom		 Tel. +44 1912004000, Email: procurement@ncgrp.co.uk		 Internet address: www.ncgrp.co.uk	VI.4.2) Body responsible for mediation procedures: 				 NCG			 Rye Hill House, Scotswood Road, Newcastle-upon-Tyne, NE4 7SA, United Kingdom			 Tel. +44 1912004000, Email: procurement@ncgrp.co.uk			 Internet address: www.ncgrp.co.uk 	VI.4.3) Review procedure	Precise information on deadline(s) for review procedures: 		 Not Provided 		VI.4.4) Service from which information about the lodging of appeals may be obtained: 			 NCG		 Rye Hill House, Scotswood Road, Newcastle-upon-Tyne, NE4 7SA, United Kingdom		 Tel. +44 1912004000, Email: procurement@ncgrp.co.uk		 Internet address: www.ncgrp.co.uk 	VI.5) Date Of Dispatch Of This Notice: 08/02/2024Annex A",educational_software_package,educational_software_package
"SPS-01610 Support and Maintenance for SPS's EPOS System This contract is for the on-going support and maintenance of SPS's Electronic Point of Sale (EPOS) system currently in use within SPS estate. CPV: 48110000, 72267000.",softwarerelated_services,softwarerelated_services
23076 the provision for a Cash Collections Services Framework agreement Cambridgeshire County Council is proposing to create a Framework with one Lot 1 only for a period of 48 months in total.It will look to award up to One (1) bidder to the Framework and Lot for fulfilment of the services.The Framework will be open to All contracting bodies within Cambridgeshire County's boundaries and will include the two Northamptonshire Councils only.The Framework agreement will be operational from April 2024.,,security_services
"Supply and Delivery of Reclaimed Mill Flags The Council requires the provision of 2000m x 1m (approximately) of reclaimed millstone flags for the surfacing of a section of the Coast to Coast Path on Nine Standards Rigg near Kirkby Stephen. Flags to be rough hewn, free of metal work and bitumen. The millstone flags must be sorted, banded as necessary and transported to Hartley Quarry, Kirkby Stephen, Cumbria.",construction_materials,construction_materials
"Travel Well adult cycle training  sessions on-referral up to June 2025 Suppliers are invited to submit a costed proposal up to £20,000 to provide one to one and small group adult cycle training provision up to 30 June 2025 for participants referred through the Nottingham City’s Travel Well active travel social prescribing programme. Contract payments will be made on a call off basis applying the rates agreed against training delivered up to the maximum contact value.",health_and_firstaid_training_services,health_and_firstaid_training_services
"23NE SGL 13 Mark It Zero Cutting The Pennsylvania Game Commission, Forestry Division, requires the services of an Operator to cut interfering woody vegetation on a location containing 60 acres within one block. Services shall include, but are not limited to, the furnishing of all materials, labor, equipment, tools, superintendence, miscellaneous items, and performing all work necessary to complete the project to the satisfaction of and subject to the approval of the Commission",logging_services,logging_services
