text,categories,expected_category
"Y1DA--558-21-106 |  Correct Atrium Fire Protection Issues The contractor shall install a new smoke exhaust system, new supply system, and roof replacement to meet the design requirements. New ducting, electrical, and fire alarm system upgrades will need to be done for the new system The contractor will have to coordinate the installation schedule with Durham VA, it is anticipated that all roof replacement will have to be done on weekends.  The contractor is responsible for providing all supervision, materials, labor, equipment, transportation, testing, and storage for this project.",fencing_railing_and_safety_equipment_installa,fencing_railing_and_safety_equipment_installa
"Repair of NIIN 01-581-2134 for FMS Norway This notice is a solicitation for the repair of 1 EA NIIN 01-581-2134 P/N 312BS101-1 Foreign Military Sales Norway. All responsible sources may submit a capability statement proposal or quotation which shall be considered by the agency. For any questions concerning this notice contact the PCO, Mackenzie Cannataro at mackenzie.cannataro.civ@us.navy.mil.",,repair_and_maintenance_services_of_warships
"16--NRP,DISPLAY MONITOR View Changes CONTACT INFORMATION|4|N761.37|WRA|215-697-2983|Ethan.Stein@navy.mil| INSPECTION AND ACCEPTANCE OF SUPPLIES (MAY 2010)|22||||||||||||||||||||||| WIDE AREA WORKFLOW PAYMENT INSTRUCTIONS (JAN 2023)|16|INVOICE AND RECEIVING REPORT COMBO TYPE12|SOURCE/SOURCE|TBD|N00383|TBD|TBD|SEE SCHEDULE|TBD|||TBD|||||| THE PURPOSE OF THIS AMENDMENT IS TO DELETE THE WSSTERMEZ03 CLAUSE AND INCORPORATE NAVSUPWSSEA05 CLAUSE.",ships,ships
Chemical Analysis of Nitrogen Gas Cylinders Chemical Analysis of Nitrogen Gas Cylinders,pollution_tracking_and_monitoring_and_rehabil,pollution_tracking_and_monitoring_and_rehabil
"355 MXG - Chemical Storage Container Amendment A00001 - The purpose of this amendment is to extend the RFQ date from 7 Feb 2024 to 13 Feb 2024.  The 355 MXG has requested the purchase of one (1) Hazardous Storage Container IAW the Salient Characteristics as well as Installation and delivery in accordance with the Performance Work Statement.  A Solicitation COMBINED SYNOPSIS/SOLICITATION is included as an attachment.  Attachment 4 - Specs is a reference drawing, however, please note that if there is a discrepancy between Attachment 4 - Specs and the Salient Characteristics document, the Salient Characteristics document will take precedent.",tanks_reservoirs_containers_and_pressure_vess,tanks_reservoirs_containers_and_pressure_vess
"Vending Solutions 2024 NHS Supply Chain: Food seeks to establish a Non-exclusive Framework Agreement for the supply of Vending Solutions to Trusts within the NHS (the ""Customer(s)""). via the Direct Route covering products from the following categories:  Cold Drinks, Snacks and Confectionery Vending Machines, Chilled Food Vending Machines, Hot Food Vending Machines, Hot Beverage Machines, Coffee Shop Solutions, Ward Beverage Trolleys, Water Dispensers, Reverse Vending, Smart Technology & Shop Solutions, Maintenance and Service.  The awarded suppliers will be responsible for the supply (as a result of re-opening of competition or direct award) who will deliver and manage Vending Solutions into the NHS and its Trusts for their catering needs.  It is anticipated that in the first 18 months the value of the Framework Agreement will be in the region of £9,750,000. This is based on the Trusts currently using the NHS Supply Chain: Food's framework.  For the full 48 month term (if extended) the anticipated value of the Framework Agreement will be in the region of £26,000,000.  These values are approximate only and are based on the most recent historical usage information, with a forecasted level of growth. The values provided are for guidance only and are not a guarantee of business.",centrifuges_calendering_or_vending_machines,centrifuges_calendering_or_vending_machines
"Septic Pumping & Portable Toilet Rental, NPS-WHIS Septic Pumping & Portable Toilet Rental, Whiskeytown National Recreation Area, Shasta County, California.The National Park Service, Whiskeytown National Recreation Area, has a requirement for Septic Pumping and rental of portable toilets and handwashing stations, in accordance with the statement of work. Offers are solicited only from small business concerns. Offers received from concerns that are not small business concerns shall be considered nonresponsive and will be rejected.See Section II for Solicitation Attachments.An organized site visit has been scheduled for Thursday, February 15, 2024 at 1:00 pm - See Section III-F for additional details. See Section III-B(g) for ""What to Submit"" with your Quotation Package, and Section III-G for how we will evaluate your quote.",specialised_chemical_products,specialised_chemical_products
N--Electrical Outlets - Tuba City Boarding School Electrical Outlets - Tuba City Boarding School,electrical_installation_work,electrical_installation_work
65+ years 65+ years,social_work_services,social_work_services
"61--POWER SUPPLY CONTACT INFORMATION|4|N721.06 |B1C |215-697-3566 |kelly.m.lynch5.civ@us.navy.mil | ITEM UNIQUE IDENTIFICATION AND VALUATION (JAN 2023)|19|||||||||||||||||||| HIGHER-LEVEL CONTRACT QUALITY REQUIREMENT|8|X|||||||| INSPECTION AND ACCEPTANCE OF SUPPLIES|26|X||||||||||||X|||||||||||||| FMS DELIVERY AND SHIPPING INSTRUCTIONS|3|||X| WIDE AREA WORKFLOW PAYMENT INSTRUCTIONS (JAN 2023)|16|INVOICE AND RECEIVING REPORT COMBO TYPE |N/A |TBD |N00383 |TBD |TBD |See Schedule |TBD ||||||||| NAVY USE OF ABILITYONE SUPPORT CONTRACTOR - RELEASE OF OFFEROR INFORMATION (3-18))|1|| EQUAL OPPORTUNITY (SEP 2016)|2||| WARRANTY OF SUPPLIES OF A NONCOMPLEX NATURE (JUN 2003)|6|12 months |60 days after discovery of defect ||||| EQUAL OPPORTUITY FOR WORKERS WITH DISABILITIES (JUN 2020)|2||| BUY AMERICAN-FREE TRADE AGREEMENTS-BALANCE OF PAYMENTS PROGRAM - BASIC (NOV\23)|5|||||| ALTERNATE A, ANNUAL REPRESENTATIONS AND CERTIFICATIONS (NOV 2023)|13|||||||||||||| BUY AMERICAN-FREE TRADE AGREEMENTS-BALANCE OF PAYMENTS PROGRAM CERTIFICATE-BASIC (NOV 2023))|5|||||| BUY AMERICAN--BALANCE OF PAYMENTS PROGRAM (NOV 2014)|1|| ROYALTY INFORMATION (APR 1984)|1|| ANNUAL REPRESENTATIONS AND CERTIFICATIONS (MAR 2023)|13|335931|600|||||||||||| FACSIMILE PROPOSALS (OCT 1997)|1|| NOTICE OF PRIORITY RATING FOR NATIONAL DEFENSE, EMERGENCY PREPAREDNESS, ANDENERGY PROGRAM USE (APR 2008))|2||X| All contractual documents (i.e. contracts, purchase orders, task orders,delivery orders and modifications) related to the instant procurement areconsidered to be ""issued"" by the Government when copies are either deposited in the mail, transmitted by facsimile, or sent by other electronic commercemethods, such as email.  The Government's acceptance of the contractor'sproposal constitutes bilateral agreement to ""issue"" contractual documents asdetailed herein. Early and incremental deliveries accepted and preferred. This is a spares requirement for FMS in support of the MH-60R HELICOPTER DCRPS System. \",ships,electricity
"58--LASER,SOLID STATE CONTACT INFORMATION|4| 721.15|B1Z|215-697-6278|svitlana.shvets.civ@us.navy.mil| ITEM UNIQUE IDENTIFICATION AND VALUATION (JAN 2023)|19| | | | | | | | | | | | | | | | | | | | HIGHER-LEVEL CONTRACT QUALITY REQUIREMENT|8| | | | | | | | | WIDE AREA WORKFLOW PAYMENT INSTRUCTIONS (JAN 2023)|16|tbd| |tbd|tbd|tbd|tbd|tbd|tbd| | | | | | | | | NAVY USE OF ABILITYONE SUPPORT CONTRACTOR - RELEASE OF OFFEROR INFORMATION (3-18))|1| | EQUAL OPPORTUNITY (SEP 2016)|2| | | EQUAL OPPORTUITY FOR WORKERS WITH DISABILITIES (JUN 2020)|2| | | BUY AMERICAN-FREE TRADE AGREEMENTS-BALANCE OF PAYMENTS PROGRAM - BASIC (NOV\23)|5| | | | | | ALTERNATE A, ANNUAL REPRESENTATIONS AND CERTIFICATIONS (NOV 2023)|13| | | | | | | | | | | | | | BUY AMERICAN-FREE TRADE AGREEMENTS-BALANCE OF PAYMENTS PROGRAM CERTIFICATE-BASIC (NOV 2023))|5| | | | | | BUY AMERICAN--BALANCE OF PAYMENTS PROGRAM (NOV 2014)|1| | ANNUAL REPRESENTATIONS AND CERTIFICATIONS (MAR 2023)|13|336413|1250| | | | | | | | | | | | FACSIMILE PROPOSALS (OCT 1997)|1| | NOTICE OF PRIORITY RATING FOR NATIONAL DEFENSE, EMERGENCY PREPAREDNESS, ANDENERGY PROGRAM USE (APR 2008))|2| |DO-A7| ALL CONTRACTUAL DOCUMENTS (I.E. CONTRACTS, PURCHASE ORDERS, TASK ORDERS DELIVERY ORDERS AND MODIFICATIONS) RELATED  TO THE INSTANT PROCUREMENT ARE CONSIDERED TO BE ""ISSUED"" BY THE GOVERNMENT WHEN COPIES ARE EITHER DEPOSITED IN THE MAIL, TRANSMITTED BY FACSIMILE, OR SENT BY OTHER ELECTRONIC COMMERCE METHODS, SUCH AS EMAIL. THE GOVERNMENT'S ACCEPTANCE OF THE CONTRACTOR'S PROPOSAL CONSTITUTES BILATERAL AGREEMENT TO ""ISSUE"" CONTRACTUAL DOCUMENTS AS DETAILED HEREIN.",helicopters_aeroplanes_spacecraft_and_other_p,helicopters_aeroplanes_spacecraft_and_other_p
"Screening Information Request (SIR)/Request for Proposal: BIL-FUNDED for Replacement of Liebert HVAC Units, Boiler & Control System @ Little Rock ATCT Base Building at Little Rock, AR 72202 The Federal Aviation Administration (FAA) has a requirement for BIL-FUNDED for Replacement of Liebert HVAC Units, Boiler & Control System @ Little Rock ATCT Base Building at Little Rock, AR 72202. The FAA contemplates a single Firm Fixed Price Contract award. The Screening Information Request (SIR)/Request for Proposal (RFP) is set-aside for Competed Small Disadvantage Business (SDB) Setaside. The NAICS code for this effort is 238220 "" Plumbing, Heating, and Air-Conditioning Contractors"" with a size standard of $19M. Each offeror must submit a proposal in accordance with the instructions in Section L of the SIR/RFP. Proposals will be evaluated in accordance with Section M of the SIR/RFP. The Government intends to make one award from this solicitation. This acquisition will utilize Lowest Priced Technically Acceptable procedures. A Firm-Fixed Price (FFP) contract will be awarded to the Lowest Priced Technically Acceptable (LPTA) offeror deemed responsible and whose proposal is responsive to the solicitation requirements. Proposals are due no later than 4:00 p.m. (Central Time Zone), March 11, 2024, and must be electronically submitted to the Contracting Officer, Bryon Nolan at Bryon.R.Nolan@faa.gov. The following information must be listed in the subject line of the e-mail proposal: 6973GH-24-R-00057 and company name in the subject line of the email. If all requested information is not furnished in the offeror's proposal, the offeror may be determined to be non-responsive and ineligible for contract award. All questions pertaining to this SIR/RFP should be sent in writing to the Contracting Officer (CO) at Bryon.R.Nolan@faa.gov by 29 February 2024, 1600, CST. NO PHONE CALLS PLEASE. All offeror questions, concerns, and clarification requests must be made in writing and submitted to Bryon.R.Nolan@faa.gov. Do not contact the program office regarding this solicitation. In addition, this SIR/RFP is not to be construed as a contract or a commitment of any kind. The Government shall not be liable for payment of any costs attributed to the preparation and submission of requested proposal documentation.",,plumbing_and_sanitary_works
