,Unnamed: 0,question,ground_truth,contexts,answer
0,0,What is resistance spot welding?,"Spot welding (or resistance spot welding) is a type of electric resistance welding used to weld various sheet metal products, through a process in which contacting metal surface points are joined by the heat obtained from resistance to electric current.","['FILENAME: PS6000_AllSystems.pdf\\nTITLE: Adaptive current/voltage control for the highest spot\\nweld quality\\nAdaptive current/voltage control for the highest spot weld quality The adaptive process control mode gives you added flexi- bility for future requirements in the welding process. By measuring current and voltage, the resistance and energy can also be recorded, controlled and accurately evaluated during welding. The adaptive control algorithm ensures consistent quality and reduces spatter in demanding weld- ing applications. Expensive rework can be reduced.\\n\\nFILENAME: External - Spot welding.pdf\\nTITLE: References\\nAnalysis of Transport Phenomena in Resistance Spot Welding Process, Transactions of the ASME, Journal of Manufacturing Science and Engineering, 2011, 133(3), 031019-1-8 10. YB Li, ZY Wei, YT Li, Q Shen, ZQ Lin, Effects of cone angle of truncated electrode on heat and mass transfer in resistance spot welding, International Journal of Heat and Mass Transfer, 2013, 65(10), 400-408 11. A. Cunningham, M. L. Begeman, \\""A Fundamental Study of Project Welding Using High Speed Photography Computer\\"", Welding Journal, 1965, Vol. 44, 381s-384s 12. Geoff Shannon, \\""Advances in Resistance Welding Technology Offer Improved Weld Quality and Reliability for Battery Manufacturers\\"", Battery Power Products & Technology, July/August 2007, Vol 11, Issue 4, [1] (http://www.batterypoweronline.com). 13. S. R. Deb; S. Deb (2010). Robotics Technology and Flexible Automation (https://books.google. com/books?id=sERj55e85bEC&pg=PA491). Tata McGraw-Hill Education. p. 491. ISBN 9780070077911. Retrieved April 18,...\\n\\nFILENAME: External - Spot welding.pdf\\nTITLE: Process and equipment\\n...metal, the electrode force and the diameter of the electrodes themselves. The equipment used in the spot welding process consists of tool holders and electrodes. The tool holders function as a mechanism to hold the electrodes firmly in place and also A spot welding robot support optional water hoses that cool the electrodes during welding. Tool holding methods include a paddle-type, light duty, universal, and regular offset. The electrodes generally are made of a low resistance alloy, usually copper, and are designed in many different shapes and sizes depending on the application needed. The two materials being welded together are known as the workpieces and must conduct electricity. The width of the workpieces is limited by the throat length of the welding apparatus and ranges typically from 5 to 50 inches (13 to 130 cm). Workpiece thickness can range from 0.008 to 17/05/2023, 10:59 1.25 inches (0.20 to 32 mm).[5] After the current is removed from the workpiece, it is cooled via...\\n\\nFILENAME: External - Spot welding.pdf\\nTITLE: Characteristics\\n...low as 1 V at the end of the weld. This decrease in voltage results from the reduction in resistance caused by the workpiece melting. The open circuit voltage from the transformer is higher than this, typically in the 5 to 22 volt range.[13] The resistance of the weld spot changes as it flows and liquefies. Modern welding equipment can monitor and adjust the weld in real time to ensure a consistent weld. The equipment may seek to control different variables during the weld, such as current, voltage, power, or energy. Welder sizes range from 5 to 500 kVA.[14] Micro spot welders, used in a variety of industries, can go down to 1.5 kVA or less for precision welding needs. It is common for a spray of molten metal droplets (sparks) to be ejected from the area of the weld during the process. Resistance spot welding generates no bright arc, so UV protection is not required. OSHA requires transparent face shields or goggles for splatter protection, but does not require any filter lens.[15]\\n\\nFILENAME: External - Spot welding.pdf\\nHIERARCHY: Spot welding\\nTITLE: Spot welding\\nSpot welding Spot welding (or resistance spot welding[1]) is a type of electric resistance welding used to weld various sheet metal products, through a process in which contacting metal surface points are joined by the heat obtained from resistance to electric current. The process uses two shaped copper alloy electrodes to concentrate welding current into a small \\""spot\\"" and to simultaneously clamp the sheets together. Work-pieces are A spot welder held together under pressure exerted by electrodes. Typically the sheets are in the 0.5 to 3 mm (0.020 to 0.118 in) thickness range. Forcing a large current through the spot will melt the metal and form the weld. The attractive feature of spot welding is that a large amount of energy can be delivered to the spot in a very short time (approximately 10ï¿½100 milliseconds).[2] This permits the welding to occur without excessive heating of the remainder of the sheet. The amount of heat (energy) delivered to the spot is determined by the...']","Resistance spot welding (or spot welding) is a type of electric resistance welding used to join various sheet metal products. In this process, contacting metal surface points are joined by the heat generated from the resistance to electric current. It involves using two shaped copper alloy electrodes to concentrate welding current into a small ""spot"" while simultaneously clamping the sheets together. This method allows for a large amount of energy to be delivered to the spot in a very short amount of time, which melts the metal and forms the weld without excessive heating of the surrounding area."
1,1,What does a welding system consist of?  ,"The welding system consists of welding hardware (welding gun, robot or multi point...), Timer module PSI 6XXX.350 L1, ME inverter PSI, welding transformer, and a programming terminal with BOS-5000 software for data entry, operation and monitoring.","['FILENAME: PS6000_AllSystems.pdf\\nTITLE: Services\\nServices On request, we will be right at your side to help you install and set up your welding systems. We can provide assist- ance in every phase of your project from parameterization right through to final optimization. Rexroth has experience in working with production line builders and end users. ? Our user interfaces and tools provide the sup- port you need during commissioning and ongoing production\\n\\nFILENAME: PS6000_AllSystems.pdf\\nTITLE: Benefits\\nBenefits\\n? High reliability achieved through the use of well tried\\nand tested technology\\n? Maximum flexibility in the I/O and network area thanks\\nto plug-in modules such as PROFIBUS, PROFINET IO,\\nDeviceNet and EtherNet/IP\\n? 100 % quality control and documentation of spot welds\\n? Innovative functions for process monitoring\\n? Expulsion reduction achieved by adaptive control of the\\nwelding process\\n? Servo gun control system\\n? Windows-based user interface for all process functions\\nwith SQL database\\n? Extensive monitoring functions for maximum system\\nprotection\\n? Flexibility for retrofitting function and modules\\nPS 6000 ï¿½ the powerful system solution for the automotive\\nindustry, suppliers and welding equipment manufacturers.\\n\\nFILENAME: PS6000_AllSystems.pdf\\nTITLE: Adaptive current/voltage control\\nSystem solution Adaptive current/voltage control Welding controller for enhanced process stability and assured spot weld quality. Extensive monitoring functions verify welding system functionality. Unique Q-Stop logic optimizes system productivity. ? ? ? ? ? ?\\n\\nFILENAME: External - Spot welding.pdf\\nTITLE: Process and equipment\\n...stages; the first of which involves the electrodes being brought to the surface of the metal and applying a slight amount of pressure. The current from the electrodes is then applied briefly after which the current is removed but the electrodes remain in place for the material to cool. Weld times range from 0.01 sec to 0.63 sec depending on the thickness of the metal, the electrode force and the diameter of the electrodes themselves. The equipment used in the spot welding process consists of tool holders and electrodes. The tool holders function as a mechanism to hold the electrodes firmly in place and also A spot welding robot support optional water hoses that cool the electrodes during welding. Tool holding methods include a paddle-type, light duty, universal, and regular offset. The electrodes generally are made of a low resistance alloy, usually copper, and are designed in many different shapes and sizes depending on the application needed. The two materials being welded...\\n\\nFILENAME: PSI6XXX - Technical Info.pdf\\nTITLE: 1.1 General\\n1 System 1.1 General Welding Timers (WT) of the PSI 6XXX.350 L1 series are suitable for spot, projection and roller seam welding, as well as for other welding processes. The welding system consists of - Welding hardware (welding gun, robot or multi point ...) - Timer module PSI 6XXX.350 L1 - MF inverter PSI - welding tansformer - A programming terminal with BOS-5000 software for data entry, operation and monitoring Figure 1: Welding system Up to 256 welding programs can be programmed and called up. Single spot (SING), re- peat mode (REPT) or seam operation can be selected. The welding parameters are stored in a RAM memory. The RAM memory has battery backup to prevent loss of data. The condition of the battery and the data is being moni- tored. The PSI 6XXX.350 L1 is an open system timer. You can select control functions from a variety of selections by entering or modifying the Basic Setup or the Welding Parameters. You can configure your control by selecting various Basic Setup...']","A welding system typically consists of welding hardware (welding gun, robot, or multi-point), timer module, MF inverter, welding transformer, and a programming terminal with software for data entry, operation, and monitoring."
2,2,Bosch use DC or AC current for welding? ,The Bosch medium-frequency welding system uses DC current for welding. ,"['FILENAME: PS6000_AllSystems.pdf\\nHIERARCHY: PS 6000 ï¿½ powerful in medium\\nfrequency and AC applications\\nTITLE: PS 6000 ï¿½ powerful in medium\\nfrequency and AC applications\\n0P1S_610 st 0H0eadline_36 pt/14.4 mm sTehceoinndtelginraeted system for perfect resistance welding PS 6000 ï¿½ powerful in medium frequency and AC applications Used in countless applications, welding systems made by the European market leader Bosch Rexroth are the first choice of satisfied car manufacturers, tier one suppliers and welding equipment manufacturers worldwide. PS 6000 for applications up to 360 kA increases process reliability, reduces rework costs and provides consistent weld spot quality ï¿½ even with the most complex material combinations. The modular concept behind the PS 6000 integrates fully compatible and coordinated components in one particularly cost-effective system: ? Intelligent inverters ? Powerful medium frequency transformers The flexible control system, adaptive control modes and highly-dynamic servo drives allow you to break into new innovative applications. Standard functions such as con- stant-current regulation, pressure regulation, electrode management...\\n\\nFILENAME: PS6000_AllSystems.pdf\\nTITLE: IFind your local contact person here:\\nIFind your local contact person here: www.boschrexroth.com/contact Further information www.boschrexroth.com/welding R999000051 (2013-10) ï¿½ Bosch Rexroth AG 2013 Subject to revisions! The data specified above only serve to describe the product. As our products are constantly being further developed, no statements concerning a certain condition or suitability for a certain application can be derived from our information. The information given does not release the user from the obligation of own judgment and verification. It must be remembered that our products are subject to a natural process of wear and aging.\\n\\nFILENAME: PSI6XXX - Technical Info.pdf\\nHIERARCHY: CAUTION!\\nTITLE: CAUTION!\\n...movement! All users, line designers, welding machine manufacturers and welding gun produ- cers are obliged to connect the output signal of the Bosch weld timer which initiates the electrode movement so that the applicable safety regulations are complied with. The risk of accidents can be considerably reduced by means of, e.g., - two-handed start - fences - light barriers etc. - Systems without Monitor contact MC (not available in all weld timers) If Monitor contact MC is connected to +24 VDC, the [squeeze times] must be selected long enough to permit optimal contact of the part to be welded prior to the [weld time]. If the [squeeze times] are too short, the electrodes close during [weld time]. This will cause strong welding splashes, resulting in damages to the elec- trodes and the part to be welded! XIV - Simulate start In remote-controlled systems, program execution may begin which may result in dangerous machine movements. Therefore, before remote starting, it must be...\\n\\nFILENAME: PS6000_AllSystems.pdf\\nTITLE: Inverter and transformers for aluminum welding\\nInverter and transformers for aluminum welding The PSI64CO adaptive welding inverter for aluminum is developed to identify the physical characteristics of the material. The comprehensive monitoring and the active regulation of the welding procedure during the operational process is now practicable for the first time. Therefore we use the proven mid-frequency/direct current technology. The material-specific properties of aluminum require higher welding currents among shorter welding times. The PSG 6180 RSTK provided ideal prerequisites for aluminum weld- ing and is thus one unit of many in Bosch Rexrothï¿½s com- prehensive line of transformers. ? The Bosch Rexroth solution for aluminum welding: The PSI 64CO inverter and PSG 6180 RSTK transformer (MF 180)\\n\\nFILENAME: PSI6XXX - Technical Info.pdf\\nTITLE: Welding current\\nWelding current The Bosch medium-frequency welding system uses DC current for welding. The duration of the welding current is programmed in milliseconds (ms). Because welds turn out to be more uniform than at 50 Hz, a higher output of correct welds is obtained. The medium-frequency welding current is clocked at 1000 Hz. The constant-current reg- ulation system is faster and more precise compared to 50 Hz welding. Upon delivery, the PSI 6XXX.350L1 is set to primary current monitoring. Figure 3: 1000 Hz welding']",Bosch uses DC current for welding in their medium-frequency welding systems according to the provided information.
